{
  "websitePurpose": "Help neighbourhood shops create accessible online catalogues",
  "primaryAudience": "Independent shop owners",
  "primaryVisitorProblem": "They need a simple online catalogue without a complex ecommerce migration",
  "desiredVisitorAction": "Book an introductory call",
  "primaryProductOrService": "Catalogue website setup",
  "keyDifferentiator": "Plain-language setup and accessibility review included",
  "geographicOrIndustryFocus": "Independent retail businesses in fictional Northport",
  "priorityPages": ["/", "/services", "/contact"],
  "targetKeywords": ["catalogue website for independent shops"],
  "preferredBrandTone": "Clear, practical, and reassuring"
}
